https://openalex.org/I52158045,1,China Agricultural University,funder,China,Beijing,CAU,Zhōngguó Nóngyè Dàxué; 中国农业大学,72179,1776247,5.121906693711968,335,33118,https://en.wikipedia.org/wiki/China%20Agricultural%20University,State Key Laboratory of Agricultural Biotechnology; State Key Laboratory of Animal Nutrition; State Key Laboratory of Plant Physiology and Biochemistry,https://openalex.org/I4391768130; https://openalex.org/I4391767711; https://openalex.org/I4391768222,,
https://openalex.org/I173759888,1,Hunan Normal University,funder,China,Changsha,HNU; HUNNU,湖南师范大学; Húnán Shīfàn Dàxué,32780,407827,3.4193337687785763,181,9353,https://en.wikipedia.org/wiki/Hunan%20Normal%20University,,,,
https://openalex.org/I4210098369,1,Institute of Disaster Prevention,facility,China,Beijing,,Institute of Disaster Prevention Science and Technology; 防灾科技学院,2915,18328,2.6891271056661563,53,456,,,,China Earthquake Administration,https://openalex.org/I90149893
https://openalex.org/I59028903,1,Ocean University of China,funder,China,Qingdao,OUC,Zhōngguó Hǎiyáng Dàxué; 中国海洋大学,56315,1017810,4.454829494733083,260,21663,https://en.wikipedia.org/wiki/Ocean%20University%20of%20China,,,,
https://openalex.org/I80281795,1,University of Otago,funder,New Zealand,Dunedin,,,80922,2736199,3.9021683673469387,478,39970,https://en.wikipedia.org/wiki/University%20of%20Otago,Riddet Institute; The Dodd-Walls Centre for Photonic and Quantum Technologies,https://openalex.org/I4210159946; https://openalex.org/I4210148749,,
https://openalex.org/I4210118629,1,NARI Group (China),facility,China,Nanjing,NARI,Nanjing Automation Research Institute; 南京自动化研究所,5936,18995,0.8011695906432749,48,394,,,,,
https://openalex.org/I204983213,1,Harbin Institute of Technology,funder,China,Harbin,HIT,哈尔滨工业大学,188535,3463483,5.263993453355155,398,68548,https://en.wikipedia.org/wiki/Harbin%20Institute%20of%20Technology,State Key Laboratory of Advanced Welding and Joining; State Key Laboratory of Robotics and Systems; State Key Laboratory of Urban Water Resources and Water Environment,https://openalex.org/I4391767836; https://openalex.org/I4391767639; https://openalex.org/I4391767770,,
https://openalex.org/I148283060,1,Lawrence Berkeley National Laboratory,funder,United States,Berkeley,LBNL; LBL,United States Department of Energy Office of Science Lawrence Berkeley National Laboratory; Berkeley Lab; Laboratoire national lawrence-berkeley,125734,6930283,4.499014814274246,824,67040,https://en.wikipedia.org/wiki/Lawrence%20Berkeley%20National%20Laboratory,Advanced Light Source; Energy Sciences Network; Environmental System Science Data Infrastructure for a Virtual Ecosystem; Joint Center for Artificial Photosynthesis; Joint Genome Institute; Molecular Foundry; National Energy Research Scientific Computing Center; National Microbiome Data Collaborative,https://openalex.org/I4387152530; https://openalex.org/I4210126023; https://openalex.org/I4387152767; https://openalex.org/I4210156299; https://openalex.org/I196679689; https://openalex.org/I4387154492; https://openalex.org/I4210151627; https://openalex.org/I4387155554,Office of Science; University of California System,https://openalex.org/I39565521; https://openalex.org/I2803209242
https://openalex.org/I78577930,1,Columbia University,funder,United States,New York,CU,Columbia College; Columbia University in the City of New York; King's College; Universidad de Columbia,358875,17846447,4.680999051533354,1181,178439,https://en.wikipedia.org/wiki/Columbia%20University,Chan Zuckerberg Biohub New York; ICAP Global Health; Lamont-Doherty Earth Observatory,https://openalex.org/I4396570641; https://openalex.org/I4387154024; https://openalex.org/I152304114,,
https://openalex.org/I4800084,1,Southwest Jiaotong University,funder,China,Chengdu,SWJTU,Xīnán Jiāotōng Dàxué; 西南交通大学,67739,900422,4.449421628755531,235,19534,https://en.wikipedia.org/wiki/Southwest%20Jiaotong%20University,Southwest Jiaotong University Hope College; State Key Laboratory of Traction Power,https://openalex.org/I4403386517; https://openalex.org/I4391768108,,
https://openalex.org/I4210103115,1,Xinjiang Institute of Ecology and Geography,funder,China,Ürümqi,XIEG,中国科学院新疆生态与地理研究所,11111,260925,4.927337173238812,168,5238,,Research Center for Ecology and Environment of Central Asia; State Key Laboratory of Desert and Oasis Ecology,https://openalex.org/I4210101675; https://openalex.org/I4391767780,Chinese Academy of Sciences,https://openalex.org/I19820366
https://openalex.org/I60205797,1,Abilene Christian University,funder,United States,Abilene,ACU,Universidad Cristiana de Abilene,2507,120654,5.466367713004484,129,887,https://en.wikipedia.org/wiki/Abilene%20Christian%20University,,,,
https://openalex.org/I116036724,1,Shenyang Ligong University,funder,China,Shenyang,SLU,Shěnyáng Lǐgōng Dàxué,7722,35434,2.275147928994083,67,927,https://en.wikipedia.org/wiki/Shenyang%20Ligong%20University,,,,
https://openalex.org/I76214153,1,Lanzhou University,funder,China,Lanzhou,,兰州大学,86506,1657973,4.4004592715443005,311,33548,https://en.wikipedia.org/wiki/Lanzhou%20University,State Key Laboratory of Applied Organic Chemistry; State Key Laboratory of Herbage Improvement and Grassland Agro-ecosystems,https://openalex.org/I4391768068; https://openalex.org/I4391768087,,
https://openalex.org/I44675526,1,Shanghai Ocean University,funder,China,Shanghai,SHOU,上海海洋大学; 上海海洋大學,21901,303786,4.393096008629989,161,7043,https://en.wikipedia.org/wiki/Shanghai%20Ocean%20University,,,,
https://openalex.org/I47720641,1,Huazhong University of Science and Technology,funder,China,Wuhan,HUST,Huázhōng Kējì Dàxué; 华中科技大学,224457,4637930,4.986482121114231,496,83343,https://en.wikipedia.org/wiki/Huazhong%20University%20of%20Science%20and%20Technology,State Key Laboratory of Advanced Electromagnetic Engineering and Technology; State Key Laboratory of Coal Combustion; State Key Laboratory of Digital Manufacturing Equipment and Technology; State Key Laboratory of Laser Technology; State Key Laboratory of Materials Processing and Die & Mould Technology; State Key Laboratory of Plasting Molding Technology,https://openalex.org/I4391767976; https://openalex.org/I4391767933; https://openalex.org/I4391767905; https://openalex.org/I4391768264; https://openalex.org/I4391767882; https://openalex.org/I4391767965,,
https://openalex.org/I163151501,1,Hangzhou Normal University,funder,China,Hangzhou,,杭州师范大学; Hángzhōu Shīfàn Dàxué,21591,367135,4.966260943839419,188,7525,https://en.wikipedia.org/wiki/Hangzhou%20Normal%20University,,,,
https://openalex.org/I2802541053,1,Academy of Military Medical Sciences,funder,China,Beijing,,中国人民解放军军事医学科学院,12774,176422,2.189466484268126,142,3159,https://en.wikipedia.org/wiki/Academy%20of%20Military%20Medical%20Sciences,State Key Laboratory of Pathogenic Microorganism Biosafety; State Key Laboratory of Proteomics,https://openalex.org/I4391768248; https://openalex.org/I4391768116,,
