https://openalex.org/I84653119,1,Academia Sinica,funder,Taiwan,Taipei,,Central Research Academy; 中央研究院; Chinese Academy,33712,693401,2.616279069767442,255,12468,https://en.wikipedia.org/wiki/Academia%20Sinica,"Agricultural Biotechnology Research Center, Academia Sinica; Biodiversity Research Center, Academia Sinica; Biomedical Translation Research Center; Genomics Research Center, Academia Sinica; Institute of Astronomy and Astrophysics, Academia Sinica; Institute of Atomic and Molecular Sciences, Academia Sinica; Institute of Biological Chemistry, Academia Sinica; Institute of Biomedical Sciences, Academia Sinica; Institute of Cellular and Organismic Biology, Academia Sinica; Institute of Chemistry, Academia Sinica; Institute of Chinese Literature and Philosophy, Academia Sinica; Institute of Earth Sciences, Academia Sinica; Institute of Economics, Academia Sinica; Institute of Ethnology, Academia Sinica; Institute of European and American Studies, Academia Sinica; Institute of History and Philology, Academia Sinica; Institute of Information Science, Academia Sinica; Institute of Linguistics, Academia Sinica; Institute of Mathematics, Academia Sinica; Institute of Modern History, Academia Sinica; Institute of Molecular Biology, Academia Sinica; Institute of Physics, Academia Sinica; Institute of Plant and Microbial Biology, Academia Sinica; Institute of Political Science, Academia Sinica; Institute of Sociology, Academia Sinica; Institute of Statistical Science, Academia Sinica; Institute of Taiwan History, Academia Sinica; Institutum Iurisprudentiae, Academia Sinica; Research Center for Applied Science, Academia Sinica; Research Center for Environmental Changes, Academia Sinica; Research Center for Humanities and Social Sciences, Academia Sinica; Research Center for Information Technology Innovation, Academia Sinica",https://openalex.org/I4210146572; https://openalex.org/I4210138331; https://openalex.org/I4210120610; https://openalex.org/I4210087491; https://openalex.org/I1311099166; https://openalex.org/I4210135784; https://openalex.org/I4210092384; https://openalex.org/I4210096666; https://openalex.org/I4210132902; https://openalex.org/I4210157360; https://openalex.org/I4210108996; https://openalex.org/I4210128530; https://openalex.org/I51434173; https://openalex.org/I4210107432; https://openalex.org/I4210104011; https://openalex.org/I4210103246; https://openalex.org/I4210098366; https://openalex.org/I4210150104; https://openalex.org/I4210099334; https://openalex.org/I4210141771; https://openalex.org/I4210136969; https://openalex.org/I4210111779; https://openalex.org/I4210093852; https://openalex.org/I4210086453; https://openalex.org/I4210101352; https://openalex.org/I4210141710; https://openalex.org/I4210130467; https://openalex.org/I4210149173; https://openalex.org/I4210098509; https://openalex.org/I4210145996; https://openalex.org/I4210150355; https://openalex.org/I4210086894,,
https://openalex.org/I4210135349,1,Shanghai Institute of Optics and Fine Mechanics,funder,China,Shanghai,SIOM,中国科学院上海光学精密机械研究所,12579,156091,3.4367909238249594,124,3792,,State Key Laboratory of High Field Laser Physics,https://openalex.org/I4391767874,Chinese Academy of Sciences,https://openalex.org/I19820366
https://openalex.org/I59433898,1,Brunel University of London,funder,United Kingdom,London,,Brunel University London,46136,1350418,4.472890833941162,361,20692,https://en.wikipedia.org/wiki/Brunel%20University%20London,,,,
https://openalex.org/I130438778,1,Memorial University of Newfoundland,funder,Canada,St. John's,MUN,Memorial University,49742,1310275,3.5109284138760777,357,21366,https://en.wikipedia.org/wiki/Memorial%20University%20of%20Newfoundland,Newfoundland and Labrador Centre for Applied Health Research,https://openalex.org/I4210127417,,
https://openalex.org/I204778367,1,Norwegian University of Science and Technology,funder,Norway,Trondheim,NTNU,Norjan teknis-luonnontieteellinen yliopisto; Norges Teknisk-Naturvitenskapelige Universitet,100887,3003658,4.208437255041687,496,47447,https://en.wikipedia.org/wiki/Norwegian%20University%20of%20Science%20and%20Technology,,,,
https://openalex.org/I76130692,1,Zhejiang University,funder,China,Hangzhou,ZJU,Zheda; Chekiang University; 浙江大学,308506,6561596,5.122229213483146,527,122689,https://en.wikipedia.org/wiki/Zhejiang%20University,Collaborative Innovation Center of Advanced Microstructures; Huzhou Central Hospital; State Key Laboratory Fluid Power and Mechatronic Systems; State Key Laboratory of Clean Energy Utilization; State Key Laboratory of Computer Aided Design and Graphics; State Key Laboratory of Diagnosis and Treatment of Infectious Diseases; State Key Laboratory of Industrial Control Technology; State Key Laboratory of Modern Optical Instruments; State Key Laboratory of Plant Physiology and Biochemistry; State Key Laboratory of Rice Biology; State Key Laboratory of Silicon Materials; The Synergetic Innovation Center for Advanced Materials; Zhejiang Taizhou Hospital; Zhejiang University-University of Edinburgh Institute,https://openalex.org/I4210140493; https://openalex.org/I4210105567; https://openalex.org/I4391767679; https://openalex.org/I4391767671; https://openalex.org/I4391767862; https://openalex.org/I4391768041; https://openalex.org/I4391767838; https://openalex.org/I4391767668; https://openalex.org/I4391768222; https://openalex.org/I4391767812; https://openalex.org/I4391767789; https://openalex.org/I4210159340; https://openalex.org/I4210158774; https://openalex.org/I4210158570,,
https://openalex.org/I1335486098,1,Electric Power Research Institute,nonprofit,United States,Palo Alto,EPRI,,13934,222353,1.9763779527559056,181,3146,https://en.wikipedia.org/wiki/Electric%20Power%20Research%20Institute,,,,
https://openalex.org/I177739611,1,Yangtze University,funder,China,Jingzhou,YU,长江大学,23515,219666,3.534726490473264,134,5393,https://en.wikipedia.org/wiki/Yangtze%20University,"Key Laboratory of Drilling and Production Engineering for Oil and Gas, Hubei Province",https://openalex.org/I4387154485,,
https://openalex.org/I3131412887,1,Jiangxi University of Technology,education,China,Jiangxi,JXUT,Jiangxi Blue Sky University; 江西科技学院,2419,10900,2.2662721893491122,47,274,https://en.wikipedia.org/wiki/Jiangxi%20University%20of%20Technology,,,,
https://openalex.org/I58956616,1,Case Western Reserve University,funder,United States,Cleveland,CWRU,Case; Case Western Reserve,162350,6593060,3.7321148415437717,749,79118,https://en.wikipedia.org/wiki/Case%20Western%20Reserve%20University,Case Comprehensive Cancer Center; Clinical and Translational Science Collaborative of Northern Ohio,https://openalex.org/I4390039247; https://openalex.org/I4391767773,,
https://openalex.org/I4210160222,1,Liaocheng People's Hospital,healthcare,China,Liaocheng,,聊城市人民医院,4995,51992,2.7168610816542946,74,1387,,,,,
https://openalex.org/I126520041,1,University of Science and Technology of China,funder,China,Hefei,USTC,中国科学技术大学,171646,4662741,6.019428644468588,535,76174,https://en.wikipedia.org/wiki/University%20of%20Science%20and%20Technology%20of%20China,CAS Key Laboratory of Urban Pollutant Conversion; Collaborative Innovation Center of Advanced Microstructures; Hefei Material Science and Technology Center; Hefei National Center for Physical Sciences at Nanoscale; National Synchrotron Radiation Laboratory; State Key Laboratory of Fire Science; State Key Laboratory of Nuclear Detection and Nuclear Electronics,https://openalex.org/I4210124140; https://openalex.org/I4210140493; https://openalex.org/I4210139613; https://openalex.org/I4210103894; https://openalex.org/I4210149848; https://openalex.org/I4391768148; https://openalex.org/I4391767989,Chinese Academy of Sciences,https://openalex.org/I19820366
https://openalex.org/I90149893,1,China Earthquake Administration,funder,China,Beijing,CEA; NEB,National Earthquake Bureau; Zhōngguó dìzhèn jú; 中国地震局; 中国地震台网中心,15454,187759,2.8911508101371,144,4181,https://en.wikipedia.org/wiki/China%20Earthquake%20Administration,"Fushun Seismological Bureau; Hebei Seismological Bureau; Heilongjiang Earthquake Agency; Institute of Disaster Prevention; Institute of Earthquake Forecasting, China Earthquake Administration; Institute of Engineering Mechanics, China Earthquake Administration; Institute of Geology, China Earthquake Administration; Ningxia Seismological Bureau; Zhangjiakou City Science and Technology and Seismological Bureau",https://openalex.org/I4210156653; https://openalex.org/I4210133073; https://openalex.org/I4210100745; https://openalex.org/I4210098369; https://openalex.org/I4408542107; https://openalex.org/I4408541831; https://openalex.org/I4391768021; https://openalex.org/I4210125232; https://openalex.org/I4210100862,,
https://openalex.org/I4210129465,1,Wuhan Ship Development & Design Institute,facility,China,Wuhan,WSDDI,武汉船舶设计研究院,7806,52317,2.9079545454545452,80,1295,,,,,
https://openalex.org/I4391768268,1,State Key Laboratory of Virology,funder,China,Wuhan,,State Key Lab of Virology; 病毒学国家重点实验室,961,30283,5.909090909090909,81,565,,,,Wuhan Institute of Virology; Wuhan University,https://openalex.org/I4210106882; https://openalex.org/I37461747
https://openalex.org/I36234482,1,University of Bristol,funder,United Kingdom,Bristol,,Prifysgol Bryste,179801,7266060,4.406453181017197,753,85649,https://en.wikipedia.org/wiki/University%20of%20Bristol,"Bristol University Press; Centre for the Observation and Modelling of Earthquakes, Volcanoes and Tectonics; MRC Integrative Epidemiology Unit; Max Planck-Bristol Centre for Minimal Biology; NIHR Bristol Biomedical Research Centre",https://openalex.org/I4394709140; https://openalex.org/I4210147017; https://openalex.org/I4387155195; https://openalex.org/I4210149754; https://openalex.org/I4210119147,,
https://openalex.org/I141649914,1,Nanchang University,funder,China,Nanchang,NCU,Nánchāng Dàxué; 南昌大学,62791,956016,4.74747857738682,243,20620,https://en.wikipedia.org/wiki/Nanchang%20University,State Key Laboratory of Food Science and Technology,https://openalex.org/I4210152154,,
https://openalex.org/I87445476,1,Xi'an Jiaotong University,funder,China,Xi'an,XJTU,Xian Jiaotong University; 西安交通大学; Xi'an Jiao Tong University,169507,3307423,5.111719076893366,419,64118,https://en.wikipedia.org/wiki/Xi%27an%20Jiaotong%20University,State Key Laboratory of Electrical Insulation and Power Equipment; State Key Laboratory of Mechanical Manufacturing System Engineering; State Key Laboratory of Mechanical Structure Strength and Vibration; State Key Laboratory of Multiphase Flow in Power Engineering; State Key Laboratory of Strength of Metallic Materials,https://openalex.org/I4391768273; https://openalex.org/I4391768051; https://openalex.org/I4391768032; https://openalex.org/I4391767999; https://openalex.org/I4391767755,,
https://openalex.org/I172675005,1,Nanyang Technological University,funder,Singapore,Singapore,NTU,南洋理工大学; நன்யாங் தொழில்நுட்பப் பல்கலைக்கழகம்; Universiti Teknologi Nanyang,166825,5618988,6.541890218737103,631,80194,https://en.wikipedia.org/wiki/Nanyang%20Technological%20University,National Institute of Education; UMI MajuLab,https://openalex.org/I194744927; https://openalex.org/I4210114908,,
https://openalex.org/I183519381,1,Capital Medical University,funder,China,Beijing,CUMS; CMU; CCMU,首都医科大学,115612,1744628,3.152490986561783,316,33860,https://en.wikipedia.org/wiki/Capital%20University%20of%20Medical%20Sciences,,,,
https://openalex.org/I43922553,1,Wuhan University of Science and Technology,funder,China,Wuhan,WUST,武汉科技大学,29632,383149,4.0119178297004865,172,7940,https://en.wikipedia.org/wiki/Wuhan%20University%20of%20Science%20and%20Technology,,,,
https://openalex.org/I187400657,1,South China Normal University,funder,China,Guangzhou,SCNU,华南师范大学,42450,680926,4.862123404815156,218,14286,https://en.wikipedia.org/wiki/South%20China%20Normal%20University,,,,
https://openalex.org/I159948400,1,Jinan University,funder,China,Guangzhou,JNU,暨南大学,63128,1174935,5.8141178474114446,274,23835,https://en.wikipedia.org/wiki/Jinan%20University,Guangdong-Hongkong-Macau Joint Laboratory of Collaborative Innovation for Environmental Quality; The Affiliated Shunde Hospital of Jinan University,https://openalex.org/I4210107815; https://openalex.org/I4392738306,,
https://openalex.org/I130480701,1,Dongbei University of Finance and Economics,education,China,Dalian,DUFE,Dongbei Institute of Finance and Economics; Liaoning Institute of Finance and Economics; 东北财经大学,6120,81126,4.46393588601959,124,1497,https://en.wikipedia.org/wiki/Dongbei%20University%20of%20Finance%20and%20Economics,,,,
https://openalex.org/I4750791,1,Henan Agricultural University,funder,China,Zhengzhou,,河南农业大学,18568,251502,4.544273339749759,151,5801,https://en.wikipedia.org/wiki/Henan%20Agricultural%20University,,,,
https://openalex.org/I166337079,1,Queen Mary University of London,funder,United Kingdom,London,QMUL,"Queen Mary College; Medical College of St Bartholomew's Hospital; London Hospital Medical College; Barts and The London School of Medicine and Dentistry; Queen Mary, Prifysgol Llundain; Westfield College",112710,4003325,5.0251422420421346,603,51167,https://en.wikipedia.org/wiki/Queen%20Mary%20University%20of%20London,William Harvey Research Institute,https://openalex.org/I4210149920,University of London,https://openalex.org/I124357947
https://openalex.org/I9224756,1,Northeastern University,funder,China,Shenyang,NEU,东北大学; Dōngběi Dàxué,77766,1188414,4.870901348474095,254,27016,https://en.wikipedia.org/wiki/Northeastern%20University%20%28China%29,State Key Laboratory of Rolling Technology and Continuous Rolling Automation; State Key Laboratory of Synthetical Automation for Process Industries,https://openalex.org/I4391768283; https://openalex.org/I4391767858,,
https://openalex.org/I118803816,1,Liaoning University,funder,China,Shenyang,,Liáoníng Dàxué; 辽宁大学,14287,157579,4.354658651781881,128,3652,https://en.wikipedia.org/wiki/Liaoning%20University,,,,
https://openalex.org/I191208505,1,Xiamen University,funder,China,Xiamen,XMU,厦门大学; Xiàmén Dàxué,97148,2126739,5.1477380223693725,388,37688,https://en.wikipedia.org/wiki/Xiamen%20University,State Key Laboratory of Cell Stress Biology; State Key Laboratory of Marine Environmental Science; Xiamen University Malaysia,https://openalex.org/I4391767808; https://openalex.org/I4391767883; https://openalex.org/I4210134189,,
https://openalex.org/I4210089756,1,Bioscience (China),company,China,Tianjin,,Bioscience (Tianjin) Diagnostic Technology; 博奥赛斯,2453,59173,4.962585034013605,105,915,,,,,
https://openalex.org/I109935558,1,Ningbo University,funder,China,Ningbo,NBU,宁波大学; Níngbō Dàxué,49009,651675,4.745329843876906,200,15594,https://en.wikipedia.org/wiki/Ningbo%20University,,,,
https://openalex.org/I105086349,1,North Sichuan Medical University,education,China,Nanchong,NSMC,川北医学院; North Sichuan Medical College,5825,43566,2.8216612377850163,74,1180,https://en.wikipedia.org/wiki/North%20Sichuan%20Medical%20University,,,,
https://openalex.org/I4210095624,1,Alibaba Group (United States),company,United States,San Mateo,,,2370,54281,7.818910256410256,101,921,https://en.wikipedia.org/wiki/Alibaba%20Group,,,Alibaba Group (China),https://openalex.org/I45928872
https://openalex.org/I29739308,1,Guangxi Normal University,funder,China,Guilin,GXNU,广西师范大学; Guǎngxī shīfàn dàxué,20138,205065,3.8481087470449173,139,4805,https://en.wikipedia.org/wiki/Guangxi%20Normal%20University,,,,
https://openalex.org/I139024713,1,Guangdong University of Technology,funder,China,Guangzhou,GDUT,Guǎngdōng Gōngyè Dàxué; 广东工业大学,45875,765028,5.712459761408824,246,15437,https://en.wikipedia.org/wiki/Guangdong%20University%20of%20Technology,,,,
https://openalex.org/I111950717,1,Macau University of Science and Technology,funder,Macao,Macao,MUST,Universidade de Ciência e Tecnologia de Macau,15829,326851,5.269271383315734,180,5660,https://en.wikipedia.org/wiki/Macau%20University%20of%20Science%20and%20Technology,Guangdong-Hongkong-Macau Joint Laboratory of Collaborative Innovation for Environmental Quality,https://openalex.org/I4210107815,Macau University of Science and Technology Foundation,https://openalex.org/I4391767947
https://openalex.org/I64449678,1,Putian University,funder,China,Putian,,莆田学院,5260,26401,2.6748466257668713,62,706,https://en.wikipedia.org/wiki/Putian%20University,,,,
https://openalex.org/I46482218,1,Anqing Normal University,funder,China,Anking,,Anqing Teachers College; 安庆师范学院,5441,41685,3.211842105263158,82,981,https://en.wikipedia.org/wiki/Anqing%20Normal%20University,,,,
https://openalex.org/I24185976,1,Sichuan University,funder,China,Chengdu,SCU,Sìchuān Dàxué; 四川大学,213216,3729564,4.69815730949031,407,76323,https://en.wikipedia.org/wiki/Sichuan%20University,State Key Laboratory of Biotherapy; State Key Laboratory of Hydraulics and Mountain River Engineering; State Key Laboratory of Oral Diseases; State Key Laboratory of Polymer Materials Engineering; West China Medical Center of Sichuan University,https://openalex.org/I4391768003; https://openalex.org/I4391767678; https://openalex.org/I4391768043; https://openalex.org/I4409876251; https://openalex.org/I2800091995,,
https://openalex.org/I3019120426,1,China Iron and Steel Research Institute Group,facility,China,Beijing,CISRI,钢铁研究总院; Central Iron & Steel Research Institute; Automation Research Institute of China,6944,80750,3.6257901390644753,94,2127,,State Key Laboratory of Advanced Steel Processing and Products,https://openalex.org/I4391767681,,
https://openalex.org/I131434179,1,Nanjing University of Chinese Medicine,funder,China,Nanjing,NJUCM,南京中医药大学; Nánjīng Zhōng Yīyào Dàxué,25372,309457,4.072759114790639,146,7532,https://en.wikipedia.org/wiki/Nanjing%20University%20of%20Chinese%20Medicine,,,,
https://openalex.org/I881766915,1,Nanjing University,funder,China,Nanjing,NU; NJU,南京大学; Nanking University,160271,3912582,5.436333276245932,475,68083,https://en.wikipedia.org/wiki/Nanjing%20University,Collaborative Innovation Center of Advanced Microstructures; Johns Hopkins University – Nanjing University Center for Chinese and American Studies; National Laboratory of Solid State Microstructures; State Key Laboratory of Analytical Chemistry for Life Science; State Key Laboratory of Metallogenic Mechanism of Endogenous Metal Deposits; State Key Laboratory of Modern Coordination Chemistry; State Key Laboratory of New Technology of Computer Software; State Key Laboratory of Pharmaceutical Biotechnology; State Key Laboratory of Pollution Control and Resource Reuse,https://openalex.org/I4210140493; https://openalex.org/I4210162165; https://openalex.org/I4391768004; https://openalex.org/I4391768173; https://openalex.org/I4391767641; https://openalex.org/I4391768193; https://openalex.org/I4391768078; https://openalex.org/I4391768045; https://openalex.org/I4210090489,,
https://openalex.org/I27781120,1,Wenzhou Medical University,funder,China,Wenzhou,WMC,温州医科大学; Wenzhou Yike Daxue,54763,816591,3.7989223400615804,230,17801,https://en.wikipedia.org/wiki/Wenzhou%20Medical%20University,,,,
https://openalex.org/I199305430,1,Nantong University,funder,China,Nantong,,南通大学; Nantong University Affiliated Tumor Hospital; Nántōng Dàxué,42837,492753,3.6514579400041955,173,12231,https://en.wikipedia.org/wiki/Nantong%20University,,,,
https://openalex.org/I26080491,1,Kunming Medical University,funder,China,Kunming,KMU,Kunming Medical College; 昆明医科大学,22874,235642,2.4683236778172306,139,5703,https://en.wikipedia.org/wiki/Kunming%20Medical%20University,,,,
https://openalex.org/I1294606314,1,Beijing Tongren Hospital,healthcare,China,Beijing,BTH,北京同仁医院; 首都医科大学附属北京同仁医院,12815,173000,2.8727272727272726,140,3208,https://en.wikipedia.org/wiki/Beijing%20Tongren%20Hospital,,,,
https://openalex.org/I78978612,1,Yangzhou University,funder,China,Yangzhou,,扬州大学,55039,875381,4.8837912986588154,255,18633,https://en.wikipedia.org/wiki/Yangzhou%20University,,,,
https://openalex.org/I31595395,1,Chengdu University of Technology,funder,China,Chengdu,CDUT,成都理工大学,24980,260739,3.8796739323055114,148,6221,https://en.wikipedia.org/wiki/Chengdu%20University%20of%20Technology,State Key Laboratory of Geohazard Prevention and Geoenvironment Protection,https://openalex.org/I4387155973,,
https://openalex.org/I113940042,1,Shanghai University,funder,China,Shanghai,SHU,上海大学; Shànghǎi Dàxué; 上海大學,85729,1377301,4.628472462764115,297,27403,https://en.wikipedia.org/wiki/Shanghai%20University,,,,
https://openalex.org/I177933477,1,Second Military Medical University,funder,China,Shanghai,SMMU,中国人民解放军海军军医大学; 第二军医大学; 中国人民解放军第二军医大学; People's Liberation Army Naval Medical University; 海军军医大学; 中國人民解放軍海軍軍醫大學,46054,918458,3.413639365918098,276,17484,https://en.wikipedia.org/wiki/Second%20Military%20Medical%20University,State Key Laboratory of Medical Immunology,https://openalex.org/I4391767733,,
https://openalex.org/I4210127530,1,Jining University,education,China,Qufu,,,2497,23648,4.996825396825397,64,564,,,,,
https://openalex.org/I89652312,1,Northwest A&F University,funder,China,Yangling,NWAFU,西北农林科技大学; Xīběi Nónglín Kējì Dàxué,51797,1179995,5.398509763617677,261,24244,https://en.wikipedia.org/wiki/Northwest%20A,,,,
https://openalex.org/I173899330,1,Henan University,funder,China,Kaifeng,,河南大学; Hénán Dàxué,39565,557465,4.814787339268052,211,12033,https://en.wikipedia.org/wiki/Henan%20University,State Key Laboratory of Cotton Biology,https://openalex.org/I4391768110,,
https://openalex.org/I2802505932,1,China Aerodynamics Research and Development Center,funder,China,Mianyang,CARDC,中国空气动力研究与发展中心; Zhōngguó Kōngqì Dònglì Yánjiū yǔ Fāzhǎn Zhōngxīn,6281,51230,2.9645669291338583,77,1366,https://en.wikipedia.org/wiki/China%20Aerodynamics%20Research%20and%20Development%20Center,State Key Laboratory of Aerodynamics,https://openalex.org/I4392738141,,
https://openalex.org/I4210122501,1,Hunan Xiangdian Test Research Institute (China),company,China,Changsha,,湖南湘电测试研究所; Hunan Provincial Electric Power High-tech Development Corporation; Hunan Provincial Xiangdian Experimental Research Institute,1737,7921,1.4012738853503184,38,192,,,,,
https://openalex.org/I154099455,1,Shandong University,funder,China,Jinan,SDU,"山东大学; Shāndōng Dàxué,",167561,3107450,4.541088510888374,369,64299,https://en.wikipedia.org/wiki/Shandong%20University,State Key Laboratory of Crystal Materials; State Key Laboratory of Microbial Technology,https://openalex.org/I4391768157; https://openalex.org/I4391767886,,
https://openalex.org/I198645480,1,North China University of Water Resources and Electric Power,funder,China,Zhengzhou,NCWU,华北水利水电大学; North China University of Water Conservancy and Electric Power,11629,91966,3.584290477954798,95,2346,https://en.wikipedia.org/wiki/North%20China%20University%20of%20Water%20Conservancy%20and%20Electric%20Power,,,,
https://openalex.org/I192209268,1,Shaoxing University,funder,China,Shaoxing,,绍兴文理学院; Shàoxīng Wénlǐ Xuéyuàn,10705,150098,5.497840596780526,135,3241,https://en.wikipedia.org/wiki/Shaoxing%20University,,,,
https://openalex.org/I103635307,1,"University of California, Riverside",funder,United States,Riverside,UCR,UC Riverside; Universidad de California en Riverside; Université de Californie à Riverside,90188,3560580,3.8875929102344196,566,46134,https://en.wikipedia.org/wiki/University%20of%20California%2C%20Riverside,,,University of California System,https://openalex.org/I2803209242
https://openalex.org/I4210165038,1,University of Chinese Academy of Sciences,funder,China,Beijing,UCAS,中国科学院大学,294555,7442021,5.5829288939051915,559,139254,https://en.wikipedia.org/wiki/University%20of%20the%20Chinese%20Academy%20of%20Sciences,International Centre for Theoretical Physics Asia-Pacific; Kavli Institute for Theoretical Sciences; Ningbo No. 2 Hospital,https://openalex.org/I4210101410; https://openalex.org/I4210105842; https://openalex.org/I4210101660,Chinese Academy of Sciences,https://openalex.org/I19820366
https://openalex.org/I24943067,1,Fudan University,funder,China,Shanghai,,復旦大學; 复旦大学,201332,4534494,4.657526550921591,516,78718,https://en.wikipedia.org/wiki/Fudan%20University,Collaborative Innovation Center of Advanced Microstructures; Shanghai Medical College of Fudan University; State Key Laboratory of ASIC and System; State Key Laboratory of Genetic Engineering; State Key Laboratory of Macromolecular Engineering; State Key Laboratory of Medical Neurobiology; State Key Laboratory of Surface Physics; Zhuhai Fudan Innovation Research Institute,https://openalex.org/I4210140493; https://openalex.org/I133868755; https://openalex.org/I4391767673; https://openalex.org/I4391768242; https://openalex.org/I4391767792; https://openalex.org/I4391768195; https://openalex.org/I4391768224; https://openalex.org/I4210110560,,
https://openalex.org/I36399199,1,Nanjing University of Science and Technology,funder,China,Nanjing,NUST,Nánlǐgōng; Nánjīng Lǐgōng Dàxué; 南京理工大学,70202,1202757,4.787794416434645,287,23579,https://en.wikipedia.org/wiki/Nanjing%20University%20of%20Science%20and%20Technology,Nanjing University of Science and Technology ZiJin College,https://openalex.org/I4403386710,,
