Qiao Zhang,1,,https://openalex.org/A5101754074,A5101754074,https://orcid.org/0000-0003-0524-2546,Qiao Zhang,"Qiao Zhang, ZHANG Qiao, ZHANG, Qiao, Zhang qiao, Zhang, Qiao",82,1550,0.5555555555555556,17,21,,,,,,,,,,,6,True,True,False,False,China,,,,,,,,,,,,,,,,True,1,2026,Xi'an Jiaotong University,China,,,,,,,,,,,,,,,,,,,,,,,,,,,,,,,,,,,,,,,,,,,,,,,,,,,,,,,,,,,,,,,,,,,https://openalex.org/I3133134087,China,Lanzhou Jiaotong University,,,,https://openalex.org/I4210121771,China,First Affiliated Hospital of Xi'an Jiaotong University,https://openalex.org/I87445476,China,Xi'an Jiaotong University,https://openalex.org/I87445476,China,Xi'an Jiaotong University,,,,https://openalex.org/I87445476,China,Xi'an Jiaotong University,https://openalex.org/I19820366,China,Chinese Academy of Sciences,https://openalex.org/I87445476,China,Xi'an Jiaotong University,https://openalex.org/I87445476,China,Xi'an Jiaotong University,https://openalex.org/I87445476,China,Xi'an Jiaotong University,https://openalex.org/I4210141849,China,"National Administration of Surveying, Mapping and Geoinformation of China",https://openalex.org/I87445476,China,Xi'an Jiaotong University,https://openalex.org/I91935597,China,University of South China,https://openalex.org/I87445476,China,Xi'an Jiaotong University,https://openalex.org/I87445476,China,Xi'an Jiaotong University,https://openalex.org/I87445476,China,Xi'an Jiaotong University,https://openalex.org/I87445476,China,Xi'an Jiaotong University,https://openalex.org/I87445476,China,Xi'an Jiaotong University,https://openalex.org/I87445476,China,Xi'an Jiaotong University,https://openalex.org/I87445476,China,Xi'an Jiaotong University
Qibin Wang,1,,https://openalex.org/A5124905368,A5124905368,,Qibin Wang,"Qibin Wang, Wang, Qibin",2,0,0.0,0,0,,,,,,,,,,,0,False,False,False,False,,,,,,,,,,,,,,,,,False,0,,,,,,,,,,,,,,,,,,,,,,,,,,,,,,,,,,,,,,,,,,,,,,,,,,,,,,,,,,,,,,,,,,,,,,,,,,,,,,,,,,,,,,,,,,,,,,,,,,,,,,,,,,,,,,,,,,,,,,,,,,,,,,,,,,,,
Qing Gu,1,,https://openalex.org/A5110367975,A5110367975,https://orcid.org/0000-0003-4963-2271,Qing Gu,"Gu Qing, Gu, Qing, Gu, Qizheng, Q Gu, Qing G. Gu, Qing GU, Qing Gu, Wen-Jie Shen",166,6810,7.5,43,98,,,,,,,,,,,10,False,True,True,False,"China, Germany, United States",,,,,,,,,,,,,,,,True,3,2025,University of Chinese Academy of Sciences,China,,,,,,,,,,,,,,,,,,,,,,,,,,,,,,,,,,,,,,,,,,,https://openalex.org/I143593769,China,East China University of Science and Technology,,,,https://openalex.org/I2802541053,China,Academy of Military Medical Sciences,,,,,,,,,,,,,,,,https://openalex.org/I4210165038,China,University of Chinese Academy of Sciences,,,,https://openalex.org/I4210164131,United States,Ophthalmology Associates (United States),https://openalex.org/I4210144289,China,Research Center for Eco-Environmental Sciences,https://openalex.org/I4210112946,China,Shanghai Institute of Organic Chemistry,https://openalex.org/I4210112946,China,Shanghai Institute of Organic Chemistry,https://openalex.org/I4210165038,China,University of Chinese Academy of Sciences,https://openalex.org/I4210112946,China,Shanghai Institute of Organic Chemistry,https://openalex.org/I74656192,Germany,University of Göttingen,https://openalex.org/I4391767815,China,State Key Laboratory of Organometallic Chemistry,https://openalex.org/I4391767815,China,State Key Laboratory of Organometallic Chemistry,https://openalex.org/I4210165038,China,University of Chinese Academy of Sciences,https://openalex.org/I4391767815,China,State Key Laboratory of Organometallic Chemistry,https://openalex.org/I4210165038,China,University of Chinese Academy of Sciences,https://openalex.org/I4210165038,China,University of Chinese Academy of Sciences,https://openalex.org/I4210165038,China,University of Chinese Academy of Sciences,https://openalex.org/I4210165038,China,University of Chinese Academy of Sciences,https://openalex.org/I881766915,China,Nanjing University,https://openalex.org/I59028903,China,Ocean University of China,https://openalex.org/I4210165038,China,University of Chinese Academy of Sciences,,,
Qiulin Feng,1,,https://openalex.org/A5113599969,A5113599969,,Qiulin Feng,"Feng, Qiulin, Qiulin Feng",4,31,0.0,1,1,,,,,,,,,,,1,True,True,False,False,China,,,,,,,,,,,,,,,,True,1,2014,Harbin Veterinary Research Institute,China,,,,,,,,,,,,,,,,,,,,,,,,,,,,,,,,,,,,,,,,,,,,,,,,,,,,,,,,,,,,,,,,,,,,,,,,,,,,,,,,,,,,,,,,,,,https://openalex.org/I72212903,China,Harbin Veterinary Research Institute,,,,,,,,,,,,,,,,,,,,,,,,,,,,,,,,,,,,
Qiwei Pan,1,,https://openalex.org/A5046824756,A5046824756,https://orcid.org/0000-0001-9169-9133,Qiwei Pan,"PAN QI-WEI, Pan Qi-Wei, Pan Qi-wei, Pan QiWei, Pan Qiwei, Pan, Q., Pan, Qiwei, Q. Pan, Q.Y. Pan, QIWEI PAN",104,2179,5.0,22,45,,,,,,,,,,,9,False,True,True,False,"China, United Kingdom, United States",,,,,,,,,,,,,,,,True,3,2026,University of Jinan,China,,,,,,,,,,,,,,,,,,,,,,,,,,,,,,,https://openalex.org/I139894009,United Kingdom,University of Bradford,,,,,,,,,,https://openalex.org/I139894009,United Kingdom,University of Bradford,https://openalex.org/I4391768157,China,State Key Laboratory of Crystal Materials,https://openalex.org/I4391768157,China,State Key Laboratory of Crystal Materials,https://openalex.org/I4391768157,China,State Key Laboratory of Crystal Materials,https://openalex.org/I4391768157,China,State Key Laboratory of Crystal Materials,https://openalex.org/I4391768157,China,State Key Laboratory of Crystal Materials,,,,https://openalex.org/I20231570,China,Peking University,https://openalex.org/I4210116048,China,Beijing National Laboratory for Molecular Sciences,https://openalex.org/I4210116048,China,Beijing National Laboratory for Molecular Sciences,https://openalex.org/I4210116048,China,Beijing National Laboratory for Molecular Sciences,https://openalex.org/I34949971,China,University of Jinan,https://openalex.org/I4210100994,China,Guangxi Hydraulic Power Machinery Research Institute,https://openalex.org/I34949971,China,University of Jinan,https://openalex.org/I34949971,China,University of Jinan,https://openalex.org/I90610280,China,South China University of Technology,https://openalex.org/I90610280,China,South China University of Technology,https://openalex.org/I922845939,United States,Philadelphia University,https://openalex.org/I90610280,China,South China University of Technology,https://openalex.org/I90610280,China,South China University of Technology,https://openalex.org/I922845939,United States,Philadelphia University,https://openalex.org/I72816309,United States,Drexel University,https://openalex.org/I90610280,China,South China University of Technology,,,,https://openalex.org/I90610280,China,South China University of Technology,https://openalex.org/I90610280,China,South China University of Technology,,,,,,,https://openalex.org/I34949971,China,University of Jinan
Qiyue Gao,1,,https://openalex.org/A5102148920,A5102148920,https://orcid.org/0009-0000-3808-3495,Qiyue Gao,"Gao, Qiyue, QIYUE GAO, Qiyue Gao",45,638,5.25,14,15,,,,,,,,,,,4,True,True,False,False,China,,,,,,,,,,,,,,,,True,1,2025,Second Affiliated Hospital of Zhejiang University,China,,,,,,,,,,,,,,,,,,,,,,,,,,,,,,,,,,,,,,,,,,,,,,,,,,,,,,,,,,,,,,,,,,,,,,,,,,,,,,,,,,,,,,,,,,,,,,https://openalex.org/I4210121771,China,First Affiliated Hospital of Xi'an Jiaotong University,https://openalex.org/I4210121771,China,First Affiliated Hospital of Xi'an Jiaotong University,,,,,,,,,,,,,,,,https://openalex.org/I47689461,China,Northeast Forestry University,https://openalex.org/I47689461,China,Northeast Forestry University,https://openalex.org/I88830068,China,Shaanxi Normal University,https://openalex.org/I4210158318,China,Second Affiliated Hospital of Zhejiang University,,,
Qizheng Gu,2,,https://openalex.org/A5036632185,A5036632185,,Qizheng Gu,"Gu, Qizheng, Gu, Qizheng 1936-, Q Gu, Q. Gu, Qianqian Gu, Qizheng Gu",39,836,0.3333333333333333,14,17,,,,,,,,,,,6,False,True,True,False,"China, Singapore, United States",,,,,,,,,,,,,,,,True,3,2025,Qufu Normal University,China,,,,,,,https://openalex.org/I63966007,United States,Massachusetts Institute of Technology,https://openalex.org/I63966007,United States,Massachusetts Institute of Technology,,,,,,,,,,,,,https://openalex.org/I63966007,United States,Massachusetts Institute of Technology,https://openalex.org/I63966007,United States,Massachusetts Institute of Technology,https://openalex.org/I63966007,United States,Massachusetts Institute of Technology,,,,,,,,,,,,,,,,,,,,,,,,,https://openalex.org/I72090969,United States,Nokia (United States),https://openalex.org/I72090969,United States,Nokia (United States),,,,,,,,,,,,,,,,,,,,,,https://openalex.org/I882086362,Singapore,Wipro (Singapore),,,,https://openalex.org/I36258959,United States,"University of California, San Diego",,,,,,,,,,,,,,,,https://openalex.org/I24943067,China,Fudan University,,,,,,,,,,,,,https://openalex.org/I202126657,China,Qufu Normal University,,,
Qucheng Gong,1,,https://openalex.org/A5052311554,A5052311554,,Qucheng Gong,"Gong, Qucheng, Qucheng Gong",15,322,10.0,8,8,,,,,,,,,,,2,False,False,True,False,"Israel, United States",,,,,,,,,,,,,,,,True,2,2020,Meta (United States),United States,,,,,,,,,,,,,,,,,,,,,,,,,,,,,,,,,,,,,,,,,,,,,,,,,,,,,,,,,,,,,,,,,,,,,,,,,,,,,,,,,,,,,,,,,,,,,,,,,,,,https://openalex.org/I2252078561,Israel,Meta (Israel),https://openalex.org/I2252078561,Israel,Meta (Israel),https://openalex.org/I2252078561,Israel,Meta (Israel),https://openalex.org/I4210114444,United States,Meta (United States),,,,,,,,,,,,,,,,,,
Ramsundar Tanikella,1,,https://openalex.org/A5120402853,A5120402853,,Ramsundar Tanikella,"Ramsundar Tanikella, Tanikella, Ramsundar",1,0,0.0,0,0,,,,,,,,,,,0,False,False,False,False,,,,,,,,,,,,,,,,,False,0,,,,,,,,,,,,,,,,,,,,,,,,,,,,,,,,,,,,,,,,,,,,,,,,,,,,,,,,,,,,,,,,,,,,,,,,,,,,,,,,,,,,,,,,,,,,,,,,,,,,,,,,,,,,,,,,,,,,,,,,,,,,,,,,,,,,
Rohan Shingre,1,,https://openalex.org/A5120650790,A5120650790,,Rohan Shingre,"Rohan Shingre, Shingre, Rohan",1,0,0.0,0,0,,,,,,,,,,,0,False,False,False,False,,,,,,,,,,,,,,,,,False,0,,,,,,,,,,,,,,,,,,,,,,,,,,,,,,,,,,,,,,,,,,,,,,,,,,,,,,,,,,,,,,,,,,,,,,,,,,,,,,,,,,,,,,,,,,,,,,,,,,,,,,,,,,,,,,,,,,,,,,,,,,,,,,,,,,,,
Rucong Wu,1,,https://openalex.org/A5054978848,A5054978848,https://orcid.org/0000-0002-2052-4632,Rucong Wu,"Rucong Wu, Wu, Rucong",5,239,0.0,3,3,,,,,,,,,,,1,True,True,False,False,China,,,,,,,,,,,,,,,,True,1,2021,China Agricultural University,China,,,,,,,,,,,,,,,,,,,,,,,,,,,,,,,,,,,,,,,,,,,,,,,,,,,,,,,,,,,,,,,,,,,,,,,,,,,,,,,,,,,,,,,,,,,,,,,,,,,,,,,,,,,,,,,,https://openalex.org/I52158045,China,China Agricultural University,,,,,,,,,,,,,,,
Rui Zhang,1,,https://openalex.org/A5124909476,A5124909476,,Rui Zhang,"Rui Zhang, Zhang, Rui",13,0,0.0,0,0,,,,,,,,,,,1,True,True,False,False,China,,,,,,,,,,,,,,,,True,1,2026,Chongqing Medical University,China,,,,,,,,,,,,,,,,,,,,,,,,,,,,,,,,,,,,,,,,,,,,,,,,,,,,,,,,,,,,,,,,,,,,,,,,,,,,,,,,,,,,,,,,,,,,,,,,,,,,,,,,,,,,,,,,,,,,,,,,,,,,,,,https://openalex.org/I87780372,China,Chongqing Medical University
Ruihan Yang,1,,https://openalex.org/A5114170123,A5114170123,,Ruihan Yang,"Ruihan Yang, Yang, Ruihan",11,7,0.6363636363636364,2,0,,,,,,,,,,,1,True,True,False,False,China,,,,,,,,,,,,,,,,True,1,2024,Qufu Normal University,China,,,,,,,,,,,,,,,,,,,,,,,,,,,,,,,,,,,,,,,,,,,,,,,,,,,,,,,,,,,,,,,,,,,,,,,,,,,,,,,,,,,,,,,,,,,,,,,,,,,,,,,,,,,,,,,,,,,,,,,,,https://openalex.org/I202126657,China,Qufu Normal University,,,,,,
Ruihan Zheng,1,,https://openalex.org/A5101386054,A5101386054,https://orcid.org/0009-0001-7676-9022,Ruihan Zheng,"Ruihan Zheng, Zheng, Ruihan",20,49,2.75,4,2,,,,,,,,,,,4,True,True,False,False,China,,,,,,,,,,,,,,,,True,1,2026,First Affiliated Hospital of Wenzhou Medical University,China,,,,,,,,,,,,,,,,,,,,,,,,,,,,,,,,,,,,,,,,,,,,,,,,,,,,,,,,,,,,,,,,,,,,,,,,,,,,,,,,,,,,,,,,,,,,,,,,,,,,,,,,,,,,,,,,,,,,,,https://openalex.org/I4210119392,China,Institute of Microelectronics,https://openalex.org/I4210132813,China,Second Affiliated Hospital of Harbin Medical University,https://openalex.org/I78974044,China,East China University of Political Science and Law,https://openalex.org/I2801769982,China,First Affiliated Hospital of Wenzhou Medical University
Ruijue Chen,2,,https://openalex.org/A5025105486,A5025105486,,Ruijue Chen,"Chen, Ruijue, Ruijue Chen",14,161,11.0,7,7,,,,,,,,,,,2,True,True,False,False,China,,,,,,,,,,,,,,,,True,1,2026,Shandong Agricultural University,China,,,,,,,,,,,,,,,,,,,,,,,,,,,,,,,,,,,,,,,,,,,,,,,,,,,,,,,,,,,,,,,,,,,,,,,,,,,,,,,,,,,,,,,,,,,,,,,,,,,,,,,,,,,,,,,,,,,https://openalex.org/I18570673,China,Guangxi University of Science and Technology,https://openalex.org/I18570673,China,Guangxi University of Science and Technology,https://openalex.org/I74485261,China,Shandong Agricultural University,,,,https://openalex.org/I74485261,China,Shandong Agricultural University
Ruiyuan Huang,1,,https://openalex.org/A5014540490,A5014540490,,Ruiyuan Huang,"Huang, Ruiyuan, Ruiyuan Huang",11,295,0.2,5,4,,,,,,,,,,,2,True,True,False,False,China,,,,,,,,,,,,,,,,True,1,2026,Fuzhou University,China,,,,,,,,,,,,,,,,,,,,,,,,,,,,,,,,,,,,,,,,,,,,,,,,,,,,,,,,,,,,,,,,,,,,,,,,,,,,,,,,,,,,,,,,,,,,,,,,,,,,,,,,,,,,,,,,https://openalex.org/I159948400,China,Jinan University,https://openalex.org/I159948400,China,Jinan University,https://openalex.org/I159948400,China,Jinan University,https://openalex.org/I159948400,China,Jinan University,,,,https://openalex.org/I80947539,China,Fuzhou University
Runjie Zhou,2,,https://openalex.org/A5113209710,A5113209710,,Runjie Zhou,"Runjie Zhou, Zhou, Runjie",5,11,3.3333333333333335,1,0,,,,,,,,,,,2,True,True,False,False,China,,,,,,,,,,,,,,,,True,1,2024,Hubei Engineering University,China,,,,,,,,,,,,,,,,,,,,,,,,,,,,,,,,,,,,,,,,,,,,,,,,,,,,,,,,,,,,,,,,,,,,,,,,,,,,,,,,,,,,,,,,,,,,,,,,,,,,,,,,,,,,,,,,,,,,,,https://openalex.org/I4210165038,China,University of Chinese Academy of Sciences,https://openalex.org/I4210154338,China,Hubei Engineering University,,,,,,
Ruobing Han,1,,https://openalex.org/A5087522518,A5087522518,https://orcid.org/0000-0003-0643-374X,Ruobing Han,"Han, Ruobing, R B Han, Ruo-Bing Han, Ruo-bing Han, Ruobing Han, Ruofeng Han",31,585,1.6666666666666667,10,10,,,,,,,,,,,7,False,True,False,False,"China, United Kingdom",,,,,,,,,,,,,,,,True,2,2025,Xinxiang Medical University,China,,,,,,,,,,,,,,,,,,,,,,,,,,,,,,,,,,,,,,,,,,,,,,,,,,,,,,,,,,,,,,,,,,,,,,,,,,,,,,,,,,,,,,,,https://openalex.org/I66867065,China,East China Normal University,,,,https://openalex.org/I4210152154,China,State Key Laboratory of Food Science and Technology,,,,https://openalex.org/I103890011,China,Shenyang Pharmaceutical University,,,,https://openalex.org/I47689461,China,Northeast Forestry University,https://openalex.org/I4210161402,China,Shanghai Municipal Center For Disease Control Prevention,https://openalex.org/I4210161402,China,Shanghai Municipal Center For Disease Control Prevention,https://openalex.org/I4210161402,China,Shanghai Municipal Center For Disease Control Prevention,,,,https://openalex.org/I4210164339,United Kingdom,Oldham Council,https://openalex.org/I80626142,China,Xinxiang Medical University,,,
Ruoyu Qin,2,,https://openalex.org/A5026524915,A5026524915,https://orcid.org/0000-0002-9663-3907,Ruoyu Qin,"Qin, Ruoyu, Ruoyu Qin",11,169,4.8,5,4,,,,,,,,,,,3,True,True,False,False,China,,,,,,,,,,,,,,,,True,1,2025,Yunnan Metallurgical Group (China),China,,,,,,,,,,,,,,,,,,,,,,,,,,,,,,,,,,,,,,,,,,,,,,,,,,,,,,,,,,,,,,,,,,,,,,,,,,,,,,,,,,,,,,,,,,,,,,,,,,,,,,,,,,,,,,,,https://openalex.org/I199305430,China,Nantong University,https://openalex.org/I199305430,China,Nantong University,https://openalex.org/I146071755,China,Kunming University,https://openalex.org/I146071755,China,Kunming University,https://openalex.org/I4210149647,China,Yunnan Metallurgical Group (China),,,
S. H. Cai,1,,https://openalex.org/A5124897615,A5124897615,,S. H. Cai,"Cai, S. H., S. H. Cai",1,0,0.0,0,0,,,,,,,,,,,0,False,False,False,False,,,,,,,,,,,,,,,,,False,0,,,,,,,,,,,,,,,,,,,,,,,,,,,,,,,,,,,,,,,,,,,,,,,,,,,,,,,,,,,,,,,,,,,,,,,,,,,,,,,,,,,,,,,,,,,,,,,,,,,,,,,,,,,,,,,,,,,,,,,,,,,,,,,,,,,,
Shangyi Geng,2,,https://openalex.org/A5124944096,A5124944096,,Shangyi Geng,"Geng, Shangyi, Shangyi Geng",2,0,0.0,0,0,,,,,,,,,,,0,False,False,False,False,,,,,,,,,,,,,,,,,False,0,,,,,,,,,,,,,,,,,,,,,,,,,,,,,,,,,,,,,,,,,,,,,,,,,,,,,,,,,,,,,,,,,,,,,,,,,,,,,,,,,,,,,,,,,,,,,,,,,,,,,,,,,,,,,,,,,,,,,,,,,,,,,,,,,,,,
Shaoguang Mao,2,,https://openalex.org/A5052035563,A5052035563,,Shaoguang Mao,"Mao, Shaoguang, Shaoguang Mao, Shaoguang Mao (毛绍光)",58,386,3.25,10,11,,,,,,,,,,,2,True,True,False,False,China,,,,,,,,,,,,,,,,True,1,2025,Microsoft Research Asia (China),China,,,,,,,,,,,,,,,,,,,,,,,,,,,,,,,,,,,,,,,,,,,,,,,,,,,,,,,,,,,,,,,,,,,,,,,,,,,,,,,,,,,,,,,,,,,,,,,,,,,,https://openalex.org/I99065089,China,Tsinghua University,https://openalex.org/I99065089,China,Tsinghua University,https://openalex.org/I99065089,China,Tsinghua University,https://openalex.org/I4210113369,China,Microsoft Research Asia (China),https://openalex.org/I4210113369,China,Microsoft Research Asia (China),https://openalex.org/I4210113369,China,Microsoft Research Asia (China),https://openalex.org/I4210113369,China,Microsoft Research Asia (China),https://openalex.org/I4210113369,China,Microsoft Research Asia (China),https://openalex.org/I4210113369,China,Microsoft Research Asia (China),,,
Shaojie Zheng,2,,https://openalex.org/A5102023520,A5102023520,https://orcid.org/0000-0002-7833-1497,Shaojie Zheng,"Shaojie ZHENG, Shaojie Zheng, Zheng, Shaojie, shaojie zheng",66,765,4.934782608695652,12,16,,,,,,,,,,,8,False,True,False,False,"China, Japan",,,,,,,,,,,,,,,,True,2,2026,Dalian University of Technology,China,,,,,,,,,,,,,,,,,,,,,,,,,,,,,,,,,,,,,,,,,,,,,,,,,,,,,,,https://openalex.org/I4210162928,Japan,Ōtani University,,,,,,,,,,,,,,,,,,,,,,,,,https://openalex.org/I159948400,China,Jinan University,https://openalex.org/I159948400,China,Jinan University,,,,,,,,,,,,,,,,https://openalex.org/I82880672,China,Beihang University,https://openalex.org/I25757504,China,China University of Mining and Technology,,,,https://openalex.org/I39333907,China,Yanshan University,https://openalex.org/I89652312,China,Northwest A&F University,https://openalex.org/I61057504,China,Fujian Agriculture and Forestry University,https://openalex.org/I61057504,China,Fujian Agriculture and Forestry University,https://openalex.org/I61057504,China,Fujian Agriculture and Forestry University,https://openalex.org/I27357992,China,Dalian University of Technology
Shaowei Liu,5,,https://openalex.org/A5102884727,A5102884727,https://orcid.org/0009-0004-6105-7999,Shaowei Liu,"Liu, Shaowei, Shaowei Liu",3,21,7.0,2,2,,,,,,,,,,,1,True,True,False,False,China,,,,,,,,,,,,,,,,True,1,2024,University of Science and Technology Beijing,China,,,,,,,,,,,,,,,,,,,,,,,,,,,,,,,,,,,,,,,,,,,,,,,,,,,,,,,,,,,,,,,,,,,,,,,,,,,,,,,,,,,,,,,,,,,,,,,,,,,,,,,,,,,,,,,,,,,,,,,,,https://openalex.org/I92403157,China,University of Science and Technology Beijing,,,,,,
Shengjie Wang,2,,https://openalex.org/A5124906033,A5124906033,,Shengjie Wang,"Shengjie Wang, Wang, Shengjie",1,0,0.0,0,0,,,,,,,,,,,0,False,False,False,False,,,,,,,,,,,,,,,,,False,0,,,,,,,,,,,,,,,,,,,,,,,,,,,,,,,,,,,,,,,,,,,,,,,,,,,,,,,,,,,,,,,,,,,,,,,,,,,,,,,,,,,,,,,,,,,,,,,,,,,,,,,,,,,,,,,,,,,,,,,,,,,,,,,,,,,,
Shengjun Fang,2,,https://openalex.org/A5113281925,A5113281925,,Shengjun Fang,"Fang, Shengjun, Shengjun Fang",3,0,0.0,0,0,,,,,,,,,,,0,False,False,False,False,,,,,,,,,,,,,,,,,False,0,,,,,,,,,,,,,,,,,,,,,,,,,,,,,,,,,,,,,,,,,,,,,,,,,,,,,,,,,,,,,,,,,,,,,,,,,,,,,,,,,,,,,,,,,,,,,,,,,,,,,,,,,,,,,,,,,,,,,,,,,,,,,,,,,,,,
Shengling Ma,2,,https://openalex.org/A5100634991,A5100634991,https://orcid.org/0000-0002-8651-8892,Shengling Ma,"Ma, Shengling, S Ma, S.L. Ma, Shengling Ma, SiQing Ma, Wang, Y, X Guo",48,188,1.9230769230769231,9,9,,,,,,,,,,,4,False,True,True,False,"China, United States",,,,,,,,,,,,,,,,True,2,2026,Baylor College of Medicine,United States,,,,,,,,,,,,,,,,,,,,,,,,,,,,,,,,,,,,,,,,,,,,,,,,,,,,,,,,,,,,,,,,,,,,,,,,,,,,,,,,,,,,,,,,,,,,,,,,,,,,,,,,,,,,,https://openalex.org/I47720641,China,Huazhong University of Science and Technology,https://openalex.org/I47720641,China,Huazhong University of Science and Technology,https://openalex.org/I76130692,China,Zhejiang University,https://openalex.org/I181547552,United States,Baylor College of Medicine,https://openalex.org/I181547552,United States,Baylor College of Medicine,https://openalex.org/I4210137153,China,Hunan Province Chest Hospital,https://openalex.org/I181547552,United States,Baylor College of Medicine
Shengyuan Shi,2,,https://openalex.org/A5124895120,A5124895120,,Shengyuan Shi,"Shengyuan Shi, Shi, Shengyuan",2,0,0.0,0,0,,,,,,,,,,,0,False,False,False,False,,,,,,,,,,,,,,,,,False,0,,,,,,,,,,,,,,,,,,,,,,,,,,,,,,,,,,,,,,,,,,,,,,,,,,,,,,,,,,,,,,,,,,,,,,,,,,,,,,,,,,,,,,,,,,,,,,,,,,,,,,,,,,,,,,,,,,,,,,,,,,,,,,,,,,,,
Shifeng Cao,2,,https://openalex.org/A5004321335,A5004321335,https://orcid.org/0000-0002-0527-4401,Shifeng Cao,"CAO, Sen, Cao, Sihan, S Cao, S. F. Cao, S. Zheng, S.F. Cao, SHIFENG CAO, Sen CAO, Sen Cao, Shi-Feng Cao",239,7622,4.635416666666667,47,115,,,,,,,,,,,9,False,True,False,False,"Australia, China",,,,,,,,,,,,,,,,True,2,2025,University of Science and Technology Beijing,China,,,,,,,,,,,,,,,,,,,,,,,,,,,,,,,,,,,,,,,,,,,,,,,,,,,,,,,,,,,,,,,,,,,,,,https://openalex.org/I119454577,China,Nanjing Agricultural University,https://openalex.org/I24943067,China,Fudan University,https://openalex.org/I4210166367,China,Nanjing Institute of Agricultural Mechanization,https://openalex.org/I4210166367,China,Nanjing Institute of Agricultural Mechanization,https://openalex.org/I4210166367,China,Nanjing Institute of Agricultural Mechanization,https://openalex.org/I4210166367,China,Nanjing Institute of Agricultural Mechanization,https://openalex.org/I4210166367,China,Nanjing Institute of Agricultural Mechanization,https://openalex.org/I4210166367,China,Nanjing Institute of Agricultural Mechanization,https://openalex.org/I4210166367,China,Nanjing Institute of Agricultural Mechanization,https://openalex.org/I4210166367,China,Nanjing Institute of Agricultural Mechanization,,,,https://openalex.org/I5681781,Australia,University of Adelaide,https://openalex.org/I5681781,Australia,University of Adelaide,https://openalex.org/I1315279114,China,Zhejiang Wanli University,https://openalex.org/I4210116001,China,Guiyang University,https://openalex.org/I1315279114,China,Zhejiang Wanli University,https://openalex.org/I156144747,China,Harbin Medical University,https://openalex.org/I9842412,China,Nanjing University of Aeronautics and Astronautics,https://openalex.org/I92403157,China,University of Science and Technology Beijing,,,
Shiyuan Teng,1,,https://openalex.org/A5124923166,A5124923166,,Shiyuan Teng,"Shiyuan Teng, Teng, Shiyuan",2,0,0.0,0,0,,,,,,,,,,,0,False,False,False,False,,,,,,,,,,,,,,,,,False,0,,,,,,,,,,,,,,,,,,,,,,,,,,,,,,,,,,,,,,,,,,,,,,,,,,,,,,,,,,,,,,,,,,,,,,,,,,,,,,,,,,,,,,,,,,,,,,,,,,,,,,,,,,,,,,,,,,,,,,,,,,,,,,,,,,,,
Shuai Zhao,1,,https://openalex.org/A5124912181,A5124912181,,Shuai Zhao,"Shuai Zhao, Zhao, Shuai",2,0,0.0,0,0,,,,,,,,,,,1,True,True,False,False,China,,,,,,,,,,,,,,,,True,1,2026,Naval University of Engineering,China,,,,,,,,,,,,,,,,,,,,,,,,,,,,,,,,,,,,,,,,,,,,,,,,,,,,,,,,,,,,,,,,,,,,,,,,,,,,,,,,,,,,,,,,,,,,,,,,,,,,,,,,,,,,,,,,,,,,,,,,,,,,,,,https://openalex.org/I2800710378,China,Naval University of Engineering
Shudong Liu,1,,https://openalex.org/A5124893220,A5124893220,,Shudong Liu,"Liu, Shudong, Shudong Liu",2,0,0.0,0,0,,,,,,,,,,,0,False,False,False,False,,,,,,,,,,,,,,,,,False,0,,,,,,,,,,,,,,,,,,,,,,,,,,,,,,,,,,,,,,,,,,,,,,,,,,,,,,,,,,,,,,,,,,,,,,,,,,,,,,,,,,,,,,,,,,,,,,,,,,,,,,,,,,,,,,,,,,,,,,,,,,,,,,,,,,,,
Shupeng Wei,1,,https://openalex.org/A5030311739,A5030311739,https://orcid.org/0000-0003-3264-2350,Shupeng Wei,"Shupeng Wei, Wei, Shupeng",4,66,10.0,3,2,,,,,,,,,,,2,False,True,False,False,"China, Switzerland",,,,,,,,,,,,,,,,True,2,2021,École Polytechnique Fédérale de Lausanne,Switzerland,,,,,,,,,,,,,,,,,,,,,,,,,,,,,,,,,,,,,,,,,,,,,,,,,,,,,,,,,,,,,,,,,,,,,,,,,,,,https://openalex.org/I108160477,China,Hebei Agricultural University,,,,,,,,,,,,,,,,,,,,,,,,,,,,,,,https://openalex.org/I5124864,Switzerland,École Polytechnique Fédérale de Lausanne,https://openalex.org/I5124864,Switzerland,École Polytechnique Fédérale de Lausanne,,,,,,,,,,,,,,,
Shuran Liu,1,,https://openalex.org/A5124901290,A5124901290,,Shuran Liu,"Liu, Shuran, Shuran Liu",2,0,0.0,0,0,,,,,,,,,,,0,False,False,False,False,,,,,,,,,,,,,,,,,False,0,,,,,,,,,,,,,,,,,,,,,,,,,,,,,,,,,,,,,,,,,,,,,,,,,,,,,,,,,,,,,,,,,,,,,,,,,,,,,,,,,,,,,,,,,,,,,,,,,,,,,,,,,,,,,,,,,,,,,,,,,,,,,,,,,,,,
Shuyi Wang,2,,https://openalex.org/A5103113484,A5103113484,https://orcid.org/0009-0002-0910-9443,Shuyi Wang,"Shuyi Wang, Wang, Shuyi",9,5,0.375,2,0,,,,,,,,,,,1,True,True,False,False,China,,,,,,,,,,,,,,,,True,1,2025,Communication University of China,China,,,,,,,,,,,,,,,,,,,,,,,,,,,,,,,,,,,,,,,,,,,,,,,,,,,,,,,,,,,,,,,,,,,,,,,,,,,,,,,,,,,,,,,,,,,,,,,,,,,,,,,,,,,,,,,,,,,,,,https://openalex.org/I75689368,China,Communication University of China,,,,https://openalex.org/I75689368,China,Communication University of China,,,
Si Wang,2,,https://openalex.org/A5124926926,A5124926926,,Si Wang,"Si Wang, Wang, Si",2,0,0.0,0,0,,,,,,,,,,,0,False,False,False,False,,,,,,,,,,,,,,,,,False,0,,,,,,,,,,,,,,,,,,,,,,,,,,,,,,,,,,,,,,,,,,,,,,,,,,,,,,,,,,,,,,,,,,,,,,,,,,,,,,,,,,,,,,,,,,,,,,,,,,,,,,,,,,,,,,,,,,,,,,,,,,,,,,,,,,,,
