https://openalex.org/I142476485,1,École Polytechnique,education,France,Palaiseau,,l'X; École Polytechnique,63160,6196172,2.6822339246119733,712,83168,http://en.wikipedia.org/wiki/%C3%89cole_Polytechnique,Laboratoire d'Optique et Biosciences; Laboratoire de Météorologie Dynamique; Laboratoire pour l'Utilisation des Lasers Intenses; Centre de Mathématiques Laurent Schwartz; Laboratoire des Solides Irradiés; Laboratoire Mécanique des Solides; Laboratoire d'Hydrodynamique de l'École polytechnique; Laboratoire de Biologie Structurale de la Cellule; Centre de Mathématiques Appliquées de l'École polytechnique; Centre de Physique Théorique; Laboratoire de Physique des Interfaces et des Couches Minces; Laboratoire d'Optique Appliquée; Centre de Recherche en Économie et Statistique; Laboratoire d'Informatique de l'École Polytechnique; Laboratoire de Synthèse Organique; Laboratoire de Physique des Plasmas; Laboratoire Leprince-Ringuet; Organisation de Micro-Electronique Générale Avancée; Microfluidique Physique et Bio-ingénierie; Institut Photovoltaïque d’Île-de-France; Institut Interdisciplinaire de l'Innovation; Laboratoire de Physique de la Matière Condensée; Laboratoire de Chimie Moléculaire; Laboratoire interdisciplinaire de l'X; Centre de gestion en recherche,https://openalex.org/I4210086343; https://openalex.org/I4210087306; https://openalex.org/I4210087526; https://openalex.org/I4210091511; https://openalex.org/I4210098568; https://openalex.org/I4210098702; https://openalex.org/I4210102092; https://openalex.org/I4210103255; https://openalex.org/I4210107641; https://openalex.org/I4210111960; https://openalex.org/I4210122671; https://openalex.org/I4210132720; https://openalex.org/I4210137396; https://openalex.org/I4210139461; https://openalex.org/I4210143563; https://openalex.org/I4210151406; https://openalex.org/I4210153175; https://openalex.org/I4387152225; https://openalex.org/I4387154142; https://openalex.org/I4387155631; https://openalex.org/I4405258429; https://openalex.org/I4405259243; https://openalex.org/I4405259868; https://openalex.org/I4405260070; https://openalex.org/I4405260108,Institut Polytechnique de Paris,https://openalex.org/I4210145102
https://openalex.org/I59553526,1,Stony Brook University,education,United States,Stony Brook,SBU,SUNY Stony Brook; State University of New York Stony Brook; Stony Brook University; Universidad de Stony Brook; Université d'État de new york à stony brook,125227,12873115,3.1767202859696155,882,154103,http://en.wikipedia.org/wiki/Stony_Brook_University,New York Sea Grant,https://openalex.org/I4210134430,State University of New York,https://openalex.org/I1327163397
https://openalex.org/I118136607,1,General Motors (United States),company,United States,Detroit,GM,General Motors (United States),15803,1067574,3.9434737923946557,373,13600,https://en.wikipedia.org/wiki/General_Motors,General Motors (Germany); General Motors (India); General Motors (Poland); General Motors (Canada),https://openalex.org/I168660222; https://openalex.org/I2801120862; https://openalex.org/I4210135317; https://openalex.org/I867584213,,
https://openalex.org/I48566637,1,Ulsan National Institute of Science and Technology,education,South Korea,Ulsan,UNIST,Ulsan Gwahak Gisul Daehakgyo; Ulsan National Institute of Science and Technology; 울산과학기술대학교; 울산과학기술원,22205,2565319,5.943845632019296,513,33731,https://en.wikipedia.org/wiki/Ulsan_National_Institute_of_Science_and_Technology,,,,
https://openalex.org/I67311998,1,European Organization for Nuclear Research,facility,Switzerland,Geneva,CERN,European Organization for Nuclear Research; Europäische Organisation für Kernforschung; Organisation européenne pour la recherche nucléaire,78200,50831771,4.179621407705845,1506,506154,https://en.wikipedia.org/wiki/CERN,SCOAP3,https://openalex.org/I4391767973,,
https://openalex.org/I151221077,1,Chung Yuan Christian University,education,Taiwan,Taoyuan City,CYCU,Chung Yuan Christian University; Tiong-gôan-tāi-ha̍k,17972,813497,3.1690074906367043,247,16772,http://en.wikipedia.org/wiki/Chung_Yuan_Christian_University,,,,
https://openalex.org/I2802366294,1,Shyam Shah Medical College,education,India,Rewa,SSMC,SSMC Rewa; Shyam Shah Medical College,1648,11279,0.18477043673012317,43,266,https://en.wikipedia.org/wiki/Shyam_Shah_Medical_College,,,,
https://openalex.org/I146416000,1,University of Kansas,education,United States,Lawrence,KU,Universidad de Kansas; University of Kansas; Université du kansas,112250,7470755,2.319081616096057,681,109125,http://en.wikipedia.org/wiki/University_of_Kansas,Center for Remote Sensing and Integrated Systems; KU Endowment; Kansas Geological Survey,https://openalex.org/I4210144928; https://openalex.org/I4210163813; https://openalex.org/I4402554214,,
https://openalex.org/I4210156625,1,Institut Alfred Fournier,facility,France,Paris,,Institut Alfred Fournier,1719,74046,1.0227272727272727,104,1377,,,,,
https://openalex.org/I4210128857,1,United States Court of Appeals for the Ninth Circuit,government,United States,San Francisco,,United States Court of Appeals for the Ninth Circuit,486,1349,0.0,18,34,https://en.wikipedia.org/wiki/United_States_Court_of_Appeals_for_the_Ninth_Circuit,,,,
https://openalex.org/I33213144,1,University of Florida,education,United States,Gainesville,UF,Universidad de la Florida; University of Florida; University of the State of Florida; Université de floride,348044,29086982,2.640940708843988,1201,397717,http://en.wikipedia.org/wiki/University_of_Florida,Florida Museum of Natural History; Florida Medical Entomology Laboratory; Florida Sea Grant; National High Magnetic Field Laboratory; The Herbert Wertheim UF Scripps Institute for Biomedical Innovation & Technology,https://openalex.org/I1313142568; https://openalex.org/I4210112726; https://openalex.org/I4210114902; https://openalex.org/I4210132808; https://openalex.org/I4387156289,State University System of Florida,https://openalex.org/I2801649442
https://openalex.org/I4210128612,1,Mission College,education,United States,Santa Clara,,Mission College,793,106413,0.9503105590062112,145,960,https://en.wikipedia.org/wiki/Mission_College_(California),,,,
https://openalex.org/I129604602,1,The University of Sydney,education,Australia,Sydney,USYD,Sydney University; The University of Sydney; University of Sydney,324630,25282447,3.90937662538871,1223,343433,http://en.wikipedia.org/wiki/University_of_Sydney,ARC Centre of Excellence for All-sky Astrophysics; Sydney Microscopy & Microanalysis; Charles Perkins Centre Histology Facility,https://openalex.org/I4210155937; https://openalex.org/I4387154357; https://openalex.org/I4405258618,,
https://openalex.org/I188592606,1,Hamilton College,education,United States,Clinton,,Hamilton College; Hamilton-Oneida Academy,4596,139050,0.96996996996997,159,2158,https://en.wikipedia.org/wiki/Hamilton_College_(New_York),,,,
https://openalex.org/I4210138427,1,Computational Physics (United States),company,United States,Springfield,,CPI; Computational Physics (United States),6009,307224,2.0136752136752136,207,3820,,,,,
https://openalex.org/I4210148301,1,Institute of Mathematics,facility,Vietnam,Hanoi,,Center for Natural Science and Technology National; Institute of Mathematics; Viện Toán học,3169,56384,0.9232053422370617,94,1313,,,,Vietnam Academy of Science and Technology,https://openalex.org/I70349855
https://openalex.org/I148314036,1,Uniformed Services University of the Health Sciences,education,United States,Bethesda,USU; USUHS,Uniformed Services University of the Health Sciences,34524,3109857,1.7883694194290094,479,41766,https://en.wikipedia.org/wiki/Uniformed_Services_University_of_the_Health_Sciences,Defense & Veterans Center for Integrative Pain Management,https://openalex.org/I4210125186,,
https://openalex.org/I72427458,1,JDSU (United States),company,United States,Milpitas,,JDS Uniphase; JDSU (United States),1860,165745,1.748,163,1716,https://en.wikipedia.org/wiki/JDSU,JDSU (Switzerland); JDSU (China); JDSU (Canada),https://openalex.org/I4210096493; https://openalex.org/I4210105198; https://openalex.org/I4210123696,,
https://openalex.org/I43968019,1,Karlstad University,education,Sweden,Karlstad,,Karlstad University; Karlstadin yliopisto; Karlstads universitet,11053,438182,2.1135707410972087,240,7707,http://en.wikipedia.org/wiki/Karlstad_University,,,,
https://openalex.org/I6902469,1,Brandeis University,education,United States,Waltham,,Brandeis University,35294,5294379,3.7132748970324214,632,57131,http://en.wikipedia.org/wiki/Brandeis_University,,,,
https://openalex.org/I2800278093,1,Sony Corporation (United States),company,United States,New York,SCA,Sony Corporation (United States),2077,59324,1.4959514170040487,111,1007,https://en.wikipedia.org/wiki/Sony_Corporation_of_America,,,,
https://openalex.org/I57093077,1,Swinburne University of Technology,education,Australia,Melbourne,,Swinburne; Swinburne University of Technology,66763,2733318,2.9283145106522124,483,39053,http://en.wikipedia.org/wiki/Swinburne_University_of_Technology,Swinburne University of Technology Sarawak Campus,https://openalex.org/I96413208,,
https://openalex.org/I8901234,1,Foundation for Research and Technology Hellas,facility,Greece,Heraklion,FORTH; ΙΤΕ,Foundation for Research and Technology Hellas; Ίδρυμα Τεχνολογίας και Έρευνας,19002,1252150,2.976906715284108,336,20865,https://en.wikipedia.org/wiki/Foundation_for_Research_%26_Technology_%E2%80%93_Hellas,FORTH Institute of Mediterranean Studies; FORTH Institute of Petroleum Research; FORTH Institute of Molecular Biology and Biotechnology; FORTH Institute of Computer Science; FORTH Institute of Chemical Engineering Sciences; FORTH Institute of Electronic Structure and Laser; FORTH Institute of Applied and Computational Mathematics; FORTH Institute of Astrophysics,https://openalex.org/I4210095522; https://openalex.org/I4210097790; https://openalex.org/I4210105723; https://openalex.org/I4210121775; https://openalex.org/I4210123829; https://openalex.org/I4210127348; https://openalex.org/I4210129470; https://openalex.org/I4210139279,,
https://openalex.org/I4210159785,1,Buffalo BioLabs,company,United States,Buffalo,BBL,Buffalo BioLabs,816,54481,0.872093023255814,110,852,,,,,
https://openalex.org/I123387679,1,Uppsala University,education,Sweden,Uppsala,,Uppsala University; Uppsala universitet; Uppsalan yliopisto,198398,17299723,2.7285045577728506,1009,226952,http://en.wikipedia.org/wiki/Uppsala_University,Center for Clinical Research Dalarna; National Bioinformatics Infrastructure Sweden,https://openalex.org/I4210130039; https://openalex.org/I4387154792,,
https://openalex.org/I4210135308,1,Servier (France),company,France,Neuilly-sur-Seine,,Laboratoires Servier; Servier (France),4277,500689,1.981554677206851,288,6093,http://en.wikipedia.org/wiki/Laboratoires_Servier,Servier (China); Servier (Canada); Servier (Egypt); Servier (United Kingdom); Servier (Spain); Servier (Germany),https://openalex.org/I4210090518; https://openalex.org/I4210091472; https://openalex.org/I4210097375; https://openalex.org/I4210126512; https://openalex.org/I4210135153; https://openalex.org/I4210161455,,
https://openalex.org/I24541011,1,Soonchunhyang University,education,South Korea,Seoul,SCH,Soonchunhyang University; 순천향대학교,20266,862547,2.5987654320987654,237,19340,http://en.wikipedia.org/wiki/Soonchunhyang_University,Soonchunhyang University Medical Center,https://openalex.org/I4405258881,,
https://openalex.org/I4210161462,1,Heilongjiang Institute of Technology,education,China,Harbin,,Heilongjiang Institute of Technology,12800,381828,3.681794287716839,189,7795,,,,,
https://openalex.org/I900231141,1,CAE (Canada),company,Canada,Montreal,,CAE (Canada); Canadian Aviation Electronics,10734,50729,4.338582677165355,84,438,https://en.wikipedia.org/wiki/CAE_Inc.,,,,
https://openalex.org/I80281795,1,University of Otago,education,New Zealand,Dunedin,,University of Otago,89528,6180230,2.3895614209168485,620,93100,http://en.wikipedia.org/wiki/University_of_Otago,The Dodd-Walls Centre for Photonic and Quantum Technologies; Riddet Institute,https://openalex.org/I4210148749; https://openalex.org/I4210159946,,
https://openalex.org/I94611258,1,Hebei Normal University,education,China,Shijiazhuang,,Hebei Normal University; 河北师范大学,18229,638975,3.1749134786268822,238,13763,https://en.wikipedia.org/wiki/Hebei_Normal_University,,,,
https://openalex.org/I901861585,1,Vanderbilt University Medical Center,healthcare,United States,Nashville,VUMC,Vanderbilt University Medical Center,75324,7553292,3.0741778667429225,746,93092,https://en.wikipedia.org/wiki/Vanderbilt_University_Medical_Center,Monroe Carell Jr. Children's Hospital; Vanderbilt Psychiatric Hospital; Vanderbilt-Ingram Cancer Center,https://openalex.org/I1299406639; https://openalex.org/I4210096570; https://openalex.org/I4390039299,Vanderbilt Health,https://openalex.org/I4210162197
https://openalex.org/I176063091,1,École Nationale Vétérinaire de Toulouse,education,France,Toulouse,ENVT,École Nationale Vétérinaire de Toulouse,9240,583212,2.029225523623965,226,10946,https://en.wikipedia.org/wiki/%C3%89cole_nationale_v%C3%A9t%C3%A9rinaire_de_Toulouse,Toxicologie Alimentaire; Digestive Health Research Institute; Interactions hôtes-agents pathogènes; Génétique Physiologie et Systèmes d'Elevage; Innovations Thérapeutiques et Résistances,https://openalex.org/I4210100066; https://openalex.org/I4210122796; https://openalex.org/I4210146726; https://openalex.org/I4210154939; https://openalex.org/I4387155783,Ministère de l'Agriculture et de la Souveraineté alimentaire; Université de Toulouse,https://openalex.org/I4210117091; https://openalex.org/I4405258862
https://openalex.org/I881427289,1,University of Gothenburg,education,Sweden,Gothenburg,,Goeteborgs Universitet; Göteborgin yliopisto; Göteborgs universitet; University of Gothenburg,139478,12002901,2.949484748557296,891,158446,http://en.wikipedia.org/wiki/University_of_Gothenburg,,,,
https://openalex.org/I4210092440,1,Hughston Clinic,healthcare,United States,Columbus,,Hughston Clinic,618,53208,1.2967032967032968,126,520,,,,,
https://openalex.org/I4210122600,1,Hunan Academy of Traditional Chinese Medicine,education,China,Changsha,,Hunan Academy of Traditional Chinese Medicine; Hunan Institute of Traditional Chinese Medicine; 湖南省中医药研究院,1837,32444,2.4239306984298863,73,797,,,,,
https://openalex.org/I13850615,1,Kunming Institute of Botany,facility,China,Kunming,KIB; KIBCAS,CAS Institute of Systematic Botany Kunming Station; Kunming Institute of Botany; Kūnmíng Zhíwù Yánjiūsuǒ; Yunnan Provincial Institute of Agricultural and Forestry Botany; 中国科学院昆明植物研究所,19359,1167878,2.2394744413541767,280,25508,https://en.wikipedia.org/wiki/Kunming_Institute_of_Botany,State Key Laboratory of Phytochemistry and Sustainable Utilization of Western Plant Resources,https://openalex.org/I4391767946,Chinese Academy of Sciences,https://openalex.org/I19820366
https://openalex.org/I4210130154,1,Laboratoire de Chimie,facility,France,Lyon,LCH,Laboratoire de Chimie; UMR 5182; UMR5182,25321,1777006,2.620746887966805,326,33168,,,,Université Claude Bernard Lyon 1; École Normale Supérieure de Lyon; Centre National de la Recherche Scientifique,https://openalex.org/I100532134; https://openalex.org/I113428412; https://openalex.org/I1294671590
https://openalex.org/I1303662053,1,Alabama Department of Public Health,government,United States,Montgomery,ADPH,Alabama Department of Public Health,1582,82820,1.960880195599022,122,1378,https://en.wikipedia.org/wiki/Alabama_Department_of_Public_Health,Calhoun County Health Department,https://openalex.org/I4210105348,,
https://openalex.org/I4210144869,1,Under Armour (United States),company,United States,Baltimore,,Under Armour (United States),1067,27535,1.5389610389610389,71,490,https://en.wikipedia.org/wiki/Under_Armour,,,,
https://openalex.org/I17974374,1,Universidade de São Paulo,education,Brazil,São Paulo,USP,Universidade de Sao Paulo; Universidade de São Paulo; University of Sao Paulo; University of São Paulo,453808,21659904,1.6884616561133035,841,431337,http://en.wikipedia.org/wiki/University_of_S%C3%A3o_Paulo,Hospital Universitário da Universidade de São Paulo; Clinics Hospital of Ribeirão Preto; Instituto de Estudos Avançados da Universidade de São Paulo; Instituto de Química de São Carlos,https://openalex.org/I4210142721; https://openalex.org/I4210156537; https://openalex.org/I4403928426; https://openalex.org/I4405263178,,
https://openalex.org/I37415318,1,Bates College,education,United States,Lewiston,,Bates College,3897,125027,1.264,149,1936,https://en.wikipedia.org/wiki/Bates_College,,,,
https://openalex.org/I2802946424,1,Johns Hopkins University Applied Physics Laboratory,facility,United States,North Laurel,APL; JHU,JHU/APL; Johns Hopkins University Applied Physics Laboratory,25850,1521832,1.6697281410727407,401,20915,https://en.wikipedia.org/wiki/Applied_Physics_Laboratory,,,Johns Hopkins University,https://openalex.org/I145311948
https://openalex.org/I67415387,1,Lancaster University,education,United Kingdom,Lancaster,,Lancaster University; Prifysgol Caerhirfryn,81289,6057049,3.1488086087624905,672,77835,http://en.wikipedia.org/wiki/Lancaster_University,New Phytologist Foundation,https://openalex.org/I4387155942,,
https://openalex.org/I4210159876,1,Institute of Physics,facility,China,Beijing,IOP,Institute of Applied Physics of the Chinese Academy of Sciences; Institute of Physics; 中国科学院物理研究所,35369,4792270,8.815715490581951,662,65271,,Songshan Lake Materials Laboratory; National Laboratory for Superconductivity; State Key Laboratory of Magnetism,https://openalex.org/I4210114608; https://openalex.org/I4210164793; https://openalex.org/I4391767957,Chinese Academy of Sciences,https://openalex.org/I19820366
https://openalex.org/I171892758,1,Forschungszentrum Jülich,facility,Germany,Jülich,FZJ,Forschungszentrum Jülich; Jülich Research Centre,87893,6835325,1.8256629143906054,620,102398,http://en.wikipedia.org/wiki/Forschungszentrum_J%C3%BClich,Ernst Ruska Centre; Helmholtz Institute Erlangen-Nürnberg; John von Neumann Institute for Computing; Cluster of Excellence on Plant Sciences; Helmholtz-Institute Münster; Jülich Aachen Research Alliance; Projektträger Jülich,https://openalex.org/I2801833913; https://openalex.org/I4210109708; https://openalex.org/I4210113364; https://openalex.org/I4210126213; https://openalex.org/I4210133623; https://openalex.org/I4210133912; https://openalex.org/I4391012604,Helmholtz Association of German Research Centres,https://openalex.org/I1305996414
https://openalex.org/I4210095140,1,National Institute of Environmental Health Sciences,facility,United States,Durham,NIEHS,National Institute of Environmental Health Sciences,24061,3863782,3.9773523231379873,574,39577,http://en.wikipedia.org/wiki/National_Institute_of_Environmental_Health_Sciences,,,National Institutes of Health,https://openalex.org/I1299303238
https://openalex.org/I4210125099,1,Mayo Clinic in Arizona,healthcare,United States,Scottsdale,,Mayo Clinic Arizona; Mayo Clinic in Arizona,123967,12320263,2.8626062072742045,952,137559,https://en.wikipedia.org/wiki/Mayo_Clinic,Mayo Clinic Hospital; Mayo Clinic Comprehensive Cancer Center (Arizona),https://openalex.org/I4210127938; https://openalex.org/I4390039332,Mayo Clinic,https://openalex.org/I1330342723
https://openalex.org/I1334627681,1,Jet Propulsion Laboratory,facility,United States,Pasadena,JPL,"Jet Propulsion Lab; Jet Propulsion Laboratory; Jet Propulsion Laboratory, California Institute of Technology; Laboratorio de Propulsión a Chorro",83722,8133966,3.5447154471544717,867,82662,http://en.wikipedia.org/wiki/Jet_Propulsion_Laboratory,Keck Institute for Space Studies,https://openalex.org/I4210163724,California Institute of Technology; National Aeronautics and Space Administration,https://openalex.org/I122411786; https://openalex.org/I4210124779
https://openalex.org/I4401726822,1,Ping An (China),company,China,Shenzhen,,China Ping An; Ping An; Ping An (China); 中国平安; 中国平安保险集团; 中国平安保险（集团）股份有限公司; 平安金融,1221,39121,3.0534188034188032,83,962,,,,,
https://openalex.org/I130238516,1,University of Minnesota,education,United States,Minneapolis,,"University of Minnesota; University of Minnesota, Twin Cities",326081,34815018,3.265068106429529,1364,414036,http://en.wikipedia.org/wiki/University_of_Minnesota,Bell Museum of Natural History; Continental Scientific Drilling Facility; Minnesota Geological Survey; Minneapolis-St. Paul Long Term Ecological Research; Minnesota Agricultural Experiment Station; Cedar Creek Ecosystem Science Reserve; Masonic Cancer Center; University of Minnesota Libraries Publishing; University of Minnesota Itasca Biological Station and Laboratories,https://openalex.org/I4387152231; https://openalex.org/I4387152554; https://openalex.org/I4387154767; https://openalex.org/I4387155566; https://openalex.org/I4387155675; https://openalex.org/I4387155916; https://openalex.org/I4390039358; https://openalex.org/I4400600966; https://openalex.org/I4405255312,University of Minnesota System,https://openalex.org/I2800403580
https://openalex.org/I4210125633,1,Sydney Children's Hospital,healthcare,Australia,Sydney,,Sydney Children's Hospital,6851,398819,2.3711747285291214,202,7181,https://en.wikipedia.org/wiki/Sydney_Children%27s_Hospital,,,Sydney Children’s Hospitals Network,https://openalex.org/I4210149013
https://openalex.org/I4210109619,1,National Institutes of Pharmaceutical Research and Development (China),company,China,Beijing,,China Pharmaceutical Research; NIP; National Institutes of Pharmaceutical Research and Development (China); 中国医药研究开发中心有限公司,486,15528,2.774436090225564,60,388,,,,,
https://openalex.org/I4210099776,1,National Council for Cement and Building Materials,facility,India,Ballabgarh,NCB,Cement Research Institute of India; National Council for Cement and Building Materials,275,6824,1.639344262295082,36,137,,,,,
https://openalex.org/I74801974,1,The University of Tokyo,education,Japan,Tokyo,UT,The University of Tokyo; Todai; Tōkyō Daigaku; UTokyo; とうきょうだいがく; トウキョウダイガク; 東京大学,488792,44492356,3.46175994074897,1355,624376,http://en.wikipedia.org/wiki/University_of_Tokyo,Laboratory for Integrated Micro-Mechatronic Systems; Spintronics Research Network of Japan; Japanese-French Laboratory for Informatics; Institute for Cosmic Ray Research,https://openalex.org/I4210088231; https://openalex.org/I4210125833; https://openalex.org/I4387152154; https://openalex.org/I4387155299,,
https://openalex.org/I4210091339,1,Laboratory of Molecular Genetics,facility,Poland,Poznań,LMG,Laboratorium Genetyki Molekularnej; Laboratory of Molecular Genetics,5733,1192884,1.9201154956689124,427,10269,,,,,
https://openalex.org/I9617848,1,Universitat Politècnica de Catalunya,education,Spain,Barcelona,UPC,BarcelonaTECH; Polytechnic University of Catalonia; Universidad Politécnica de Cataluña; Universidade Politécnica de Cataluña; Universitat Politècnica de Catalunya,94933,4783785,2.246962188581902,562,85356,https://en.wikipedia.org/wiki/Polytechnic_University_of_Catalonia,Institute of Photonic Sciences; Barcelona Supercomputing Center; Institut de Robòtica i Informàtica Industrial; International Center for Numerical Methods in Engineering,https://openalex.org/I179630473; https://openalex.org/I2799803557; https://openalex.org/I4210093282; https://openalex.org/I4210127182,,
https://openalex.org/I1290206253,1,Microsoft (United States),company,United States,Redmond,,Microsoft (United States); Microsoft Corporation,33365,4380123,11.749959009673717,746,33406,https://en.wikipedia.org/wiki/Microsoft,LinkedIn (United States); Microsoft (Brazil); Microsoft (Germany); Microsoft (Portugal); Microsoft (Denmark); Microsoft (Finland); Microsoft (United Kingdom); Microsoft (Ireland); Microsoft (Netherlands); Microsoft Research Asia (China); Microsoft Research (India); Microsoft (Israel); Microsoft (Norway); Microsoft (Switzerland); Microsoft (Belgium); Microsoft (Canada); Microsoft (France); Microsoft (India); Microsoft Research (United Kingdom); Ninja Theory (United Kingdom); Microsoft Research New England (United States); Microsoft Research New York City (United States); Microsoft Research Montréal (Canada); Microsoft (Singapore),https://openalex.org/I1316064682; https://openalex.org/I4210086099; https://openalex.org/I4210087053; https://openalex.org/I4210092974; https://openalex.org/I4210099966; https://openalex.org/I4210105678; https://openalex.org/I4210108625; https://openalex.org/I4210109507; https://openalex.org/I4210110431; https://openalex.org/I4210113369; https://openalex.org/I4210124949; https://openalex.org/I4210125051; https://openalex.org/I4210135422; https://openalex.org/I4210139986; https://openalex.org/I4210151458; https://openalex.org/I4210153468; https://openalex.org/I4210161634; https://openalex.org/I4210162141; https://openalex.org/I4210164937; https://openalex.org/I4392738289; https://openalex.org/I4400600948; https://openalex.org/I4401726785; https://openalex.org/I4402554038; https://openalex.org/I4405255490,,
https://openalex.org/I4210115083,1,TÜBİTAK Marmara Research Center,government,Turkey,Gebze,TUBITAK MAM,TÜBİTAK Marmara Araştırma Merkezi; TÜBİTAK Marmara Research Center,3311,119909,3.2294685990338166,127,2573,https://en.wikipedia.org/wiki/T%C3%9CB%C4%B0TAK_Marmara_Research_Center,,,Scientific and Technological Research Council of Turkey,https://openalex.org/I198068145
